20:15:07.787295 IP 0.0.0.0.68 > 255.255.255.255.67: BOOTP/DHCP, Request from 00:4f:49:b1:e8:c3, length 302
20:15:07.787997 IP 10.9.10.9.67 > 255.255.255.255.68: BOOTP/DHCP, Reply, length 309
20:15:07.790675 IP 0.0.0.0.68 > 255.255.255.255.67: BOOTP/DHCP, Request from 00:4f:49:b1:e8:c3, length 345
20:15:07.791650 IP 10.9.10.9.67 > 255.255.255.255.68: BOOTP/DHCP, Reply, length 314
20:15:07.932871 IP 169.254.181.227.137 > 169.254.255.255.137: UDP, length 68
20:15:07.932872 IP 169.254.181.227.137 > 169.254.255.255.137: UDP, length 68
20:15:07.932873 IP 169.254.181.227.137 > 169.254.255.255.137: UDP, length 68
20:15:08.684598 IP 169.254.181.227.137 > 169.254.255.255.137: UDP, length 68
20:15:08.684599 IP 169.254.181.227.137 > 169.254.255.255.137: UDP, length 68
20:15:08.684600 IP 169.254.181.227.137 > 169.254.255.255.137: UDP, length 68
20:15:09.495571 IP 169.254.181.227.137 > 169.254.255.255.137: UDP, length 68
20:15:09.531811 IP 10.9.10.102 > 224.0.0.22: igmp v3 report, 1 group record(s)
20:15:09.531812 IP 10.9.10.102 > 224.0.0.22: igmp v3 report, 1 group record(s)
20:15:09.531814 ARP, Request who-has 10.9.10.9 tell 10.9.10.102, length 46
20:15:09.531893 ARP, Reply 10.9.10.9 is-at 14:18:77:0f:c6:9e, length 46
20:15:09.538560 IP 10.9.10.102 > 224.0.0.22: igmp v3 report, 1 group record(s)
20:15:09.538561 IP 10.9.10.102 > 224.0.0.22: igmp v3 report, 1 group record(s)
20:15:09.538659 IP 10.9.10.102.53124 > 10.9.10.9.53: 18599+ A? wpad.angrypoutine.com. (39)
20:15:09.539026 IP 10.9.10.9.53 > 10.9.10.102.53124: 18599 NXDomain* 0/1/0 (118)
20:15:09.547060 IP 10.9.10.102 > 224.0.0.22: igmp v3 report, 1 group record(s)
20:15:09.547061 IP 10.9.10.102 > 224.0.0.22: igmp v3 report, 1 group record(s)
20:15:09.547238 IP 10.9.10.102.60310 > 10.9.10.9.53: 49321+ SOA? DESKTOP-KKITB6Q.angrypoutine.com. (50)
20:15:09.547578 IP 10.9.10.9.53 > 10.9.10.102.60310: 49321* 0/1/1 (129)
20:15:09.548689 IP 10.9.10.102 > 224.0.0.22: igmp v3 report, 1 group record(s)
20:15:09.548778 IP 10.9.10.102 > 224.0.0.22: igmp v3 report, 1 group record(s)
20:15:09.550830 IP 10.9.10.102.64814 > 10.9.10.9.53: 50985 update [1a] [3n] SOA? angrypoutine.com. (118)
20:15:09.550831 IP 10.9.10.102.5353 > 224.0.0.251.5353: 0 ANY (QM)? DESKTOP-KKITB6Q.local. (39)
20:15:09.550832 IP 10.9.10.102.5353 > 224.0.0.251.5353: 0*- [0q] 1/0/0 A 10.9.10.102 (49)
20:15:09.551279 IP 10.9.10.102.58033 > 224.0.0.252.5355: UDP, length 33
20:15:09.551563 IP 10.9.10.9.53 > 10.9.10.102.64814: 50985 update- 1/3/0 (Class 254) CNAME DESKTOP-KKITB6Q.angrypoutine.com. (118)
20:15:09.575825 IP 10.9.10.102.137 > 10.9.10.255.137: UDP, length 68
20:15:09.778075 IP 10.9.10.102.58035 > 239.255.255.250.1900: UDP, length 137
20:15:09.809136 ARP, Request who-has 10.9.10.102 tell 0.0.0.0, length 46
20:15:09.809138 IP 10.9.10.102 > 224.0.0.22: igmp v3 report, 2 group record(s)
20:15:10.258173 IP 10.9.10.102.137 > 10.9.10.255.137: UDP, length 68
20:15:10.353794 IP 10.9.10.102.137 > 10.9.10.255.137: UDP, length 68
20:15:10.813898 ARP, Request who-has 10.9.10.102 tell 0.0.0.0, length 46
20:15:11.017650 IP 10.9.10.102.137 > 10.9.10.255.137: UDP, length 68
20:15:11.019152 IP 10.9.10.102.62920 > 10.9.10.9.53: 47490+ SRV? _ldap._tcp.Default-First-Site-Name._sites.dc._msdcs.angrypoutine.com. (86)
20:15:11.019480 IP 10.9.10.9.53 > 10.9.10.102.62920: 47490* 1/0/1 SRV angrypoutine-dc.angrypoutine.com.:389 0 100 (154)
20:15:11.022144 IP 10.9.10.102.63367 > 10.9.10.9.53: 35018+ A? angrypoutine-dc.angrypoutine.com. (50)
20:15:11.022428 IP 10.9.10.9.53 > 10.9.10.102.63367: 35018* 1/0/0 A 10.9.10.9 (66)
20:15:11.117648 IP 10.9.10.102.137 > 10.9.10.255.137: UDP, length 68
20:15:11.117649 IP 10.9.10.102.63367 > 10.9.10.9.53: 35018+ A? angrypoutine-dc.angrypoutine.com. (50)
20:15:11.117830 IP 10.9.10.9.53 > 10.9.10.102.63367: 35018* 1/0/0 A 10.9.10.9 (66)
20:15:11.118441 IP 10.9.10.102.63368 > 10.9.10.9.389: UDP, length 227
20:15:11.118866 IP 10.9.10.9.389 > 10.9.10.102.63368: UDP, length 202
20:15:11.228276 IP 10.9.10.102.123 > 10.9.10.9.123: NTPv3, Client, length 120
20:15:11.229729 IP 10.9.10.9.123 > 10.9.10.102.123: NTPv3, Server, length 120
20:15:11.789000 IP 10.9.10.102.137 > 10.9.10.255.137: UDP, length 68
20:15:11.806598 ARP, Request who-has 10.9.10.102 tell 0.0.0.0, length 46
20:15:11.869204 IP 10.9.10.102.137 > 10.9.10.255.137: UDP, length 68
20:15:12.599977 IP 10.9.10.102.137 > 10.9.10.255.137: UDP, length 68
20:15:12.599978 IP 10.9.10.102.137 > 10.9.10.255.137: UDP, length 68
20:15:12.687123 IP 10.9.10.102.138 > 10.9.10.255.138: UDP, length 201
20:15:12.778108 IP 10.9.10.102.58035 > 239.255.255.250.1900: UDP, length 137
20:15:12.809333 ARP, Request who-has 10.9.10.102 tell 10.9.10.102, length 46
20:15:13.358829 IP 10.9.10.102.137 > 10.9.10.255.137: UDP, length 68
20:15:13.358831 IP 10.9.10.102.137 > 10.9.10.255.137: UDP, length 68
20:15:14.122639 IP 10.9.10.102.137 > 10.9.10.255.137: UDP, length 68
20:15:14.122641 IP 10.9.10.102.137 > 10.9.10.255.137: UDP, length 68
20:15:14.160252 IP 10.9.10.102.55937 > 10.9.10.9.53: 16903+ A? www.msftncsi.com. (34)
20:15:14.217547 IP 10.9.10.102.64956 > 10.9.10.9.53: 29660+ A? wpad.angrypoutine.com. (39)
20:15:14.217859 IP 10.9.10.9.53 > 10.9.10.102.64956: 29660 NXDomain* 0/1/0 (118)
20:15:14.230509 IP 10.9.10.9.53 > 10.9.10.102.55937: 16903 4/0/0 CNAME www.msftncsi.com.edgesuite.net., CNAME a1961.g2.akamai.net., A 96.17.68.66, A 96.17.68.83 (140)
20:15:14.233040 ARP, Request who-has 10.9.10.1 tell 10.9.10.102, length 46
20:15:14.233157 ARP, Reply 10.9.10.1 is-at 00:a2:89:12:d3:d7, length 46
20:15:14.252143 ARP, Request who-has 10.9.10.102 (00:4f:49:b1:e8:c3) tell 10.9.10.9, length 46
20:15:14.252737 IP 10.9.10.102.58079 > 96.17.68.66.80: Flags [S], seq 957480256, win 64240, options [mss 1460,nop,wscale 8,nop,nop,sackOK], length 0
20:15:14.253354 ARP, Reply 10.9.10.102 is-at 00:4f:49:b1:e8:c3, length 46
20:15:14.318789 IP 96.17.68.66.80 > 10.9.10.102.58079: Flags [S.], seq 3371363164, ack 957480257, win 29200, options [mss 1361,nop,nop,sackOK,nop,wscale 7], length 0
20:15:14.885657 IP 10.9.10.102.137 > 10.9.10.255.137: UDP, length 68
20:15:14.885658 IP 10.9.10.102.137 > 10.9.10.255.137: UDP, length 68
20:15:14.885850 IP 10.9.10.102.58079 > 96.17.68.66.80: Flags [.], ack 1, win 515, length 0
20:15:14.886095 IP 10.9.10.102.58079 > 96.17.68.66.80: Flags [P.], seq 1:98, ack 1, win 515, length 97: HTTP: GET /ncsi.txt HTTP/1.1
20:15:14.887521 IP 10.9.10.102.58080 > 10.9.10.9.389: Flags [S], seq 891623568, win 64240, options [mss 1460,nop,wscale 8,nop,nop,sackOK], length 0
20:15:14.887662 IP 10.9.10.9.389 > 10.9.10.102.58080: Flags [S.], seq 1816540565, ack 891623569, win 65535, options [mss 1460,nop,wscale 8,nop,nop,sackOK], length 0
20:15:14.901645 IP 10.9.10.102.58080 > 10.9.10.9.389: Flags [.], ack 1, win 513, length 0
20:15:14.903565 IP 10.9.10.102.58080 > 10.9.10.9.389: Flags [.], seq 1:1461, ack 1, win 513, length 1460
20:15:14.903567 IP 10.9.10.102.58080 > 10.9.10.9.389: Flags [P.], seq 1461:2002, ack 1, win 513, length 541
20:15:14.903657 IP 10.9.10.9.389 > 10.9.10.102.58080: Flags [.], ack 2002, win 513, length 0
20:15:14.905140 IP 10.9.10.9.389 > 10.9.10.102.58080: Flags [P.], seq 1:211, ack 2002, win 513, length 210
20:15:14.907528 IP 10.9.10.102.58080 > 10.9.10.9.389: Flags [P.], seq 2002:2045, ack 211, win 512, length 43
20:15:14.907529 IP 10.9.10.102.58080 > 10.9.10.9.389: Flags [F.], seq 2045, ack 211, win 512, length 0
20:15:14.907634 IP 10.9.10.9.389 > 10.9.10.102.58080: Flags [.], ack 2046, win 513, length 0
20:15:14.907750 IP 10.9.10.9.389 > 10.9.10.102.58080: Flags [R.], seq 211, ack 2046, win 0, length 0
20:15:14.964064 IP 96.17.68.66.80 > 10.9.10.102.58079: Flags [.], ack 98, win 229, length 0
20:15:14.964194 IP 96.17.68.66.80 > 10.9.10.102.58079: Flags [P.], seq 1:180, ack 98, win 229, length 179: HTTP: HTTP/1.1 200 OK
20:15:14.964580 IP 96.17.68.66.80 > 10.9.10.102.58079: Flags [F.], seq 180, ack 98, win 229, length 0
20:15:14.965407 IP 10.9.10.102.58079 > 96.17.68.66.80: Flags [.], ack 181, win 514, length 0
20:15:14.965408 IP 10.9.10.102.58079 > 96.17.68.66.80: Flags [F.], seq 98, ack 181, win 514, length 0
20:15:15.033857 IP 96.17.68.66.80 > 10.9.10.102.58079: Flags [.], ack 99, win 229, length 0
20:15:15.057664 IP 10.9.10.102.58035 > 239.255.255.250.1900: UDP, length 137
20:15:15.513126 IP 10.9.10.102.58081 > 40.83.240.146.443: Flags [S], seq 2133500493, win 64240, options [mss 1460,nop,wscale 8,nop,nop,sackOK], length 0
20:15:15.593519 IP 40.83.240.146.443 > 10.9.10.102.58081: Flags [S.], seq 4273187460, ack 2133500494, win 8192, options [mss 1361,nop,wscale 0,nop,nop,sackOK], length 0
20:15:15.607867 IP 10.9.10.102.58081 > 40.83.240.146.443: Flags [.], ack 1, win 515, length 0
20:15:15.609283 IP 10.9.10.102.58081 > 40.83.240.146.443: Flags [P.], seq 1:185, ack 1, win 515, length 184
20:15:15.685778 IP 10.9.10.102.138 > 10.9.10.255.138: UDP, length 186
20:15:15.696362 IP 40.83.240.146.443 > 10.9.10.102.58081: Flags [.], seq 1:1362, ack 185, win 8008, length 1361
20:15:15.696364 IP 40.83.240.146.443 > 10.9.10.102.58081: Flags [P.], seq 1362:1461, ack 185, win 8008, length 99
20:15:15.696962 IP 40.83.240.146.443 > 10.9.10.102.58081: Flags [.], seq 1461:2822, ack 185, win 8008, length 1361
20:15:15.696976 IP 40.83.240.146.443 > 10.9.10.102.58081: Flags [P.], seq 2822:2921, ack 185, win 8008, length 99
20:15:15.697150 IP 40.83.240.146.443 > 10.9.10.102.58081: Flags [P.], seq 2921:3912, ack 185, win 8008, length 991
20:15:15.697726 IP 10.9.10.102.58081 > 40.83.240.146.443: Flags [.], ack 3912, win 515, length 0
20:15:15.701649 IP 10.9.10.102.58081 > 40.83.240.146.443: Flags [P.], seq 185:343, ack 3912, win 515, length 158
20:15:15.781766 IP 10.9.10.102.58035 > 239.255.255.250.1900: UDP, length 137
20:15:15.817953 IP 40.83.240.146.443 > 10.9.10.102.58081: Flags [P.], seq 3912:3963, ack 343, win 7850, length 51
20:15:16.011014 IP 10.9.10.102.58081 > 40.83.240.146.443: Flags [P.], seq 185:343, ack 3912, win 515, length 158
20:15:16.014175 IP 10.9.10.102.58081 > 40.83.240.146.443: Flags [P.], seq 343:686, ack 3963, win 515, length 343
20:15:16.014460 IP 10.9.10.102.58081 > 40.83.240.146.443: Flags [P.], seq 686:1791, ack 3963, win 515, length 1105
20:15:16.014461 IP 10.9.10.102.58081 > 40.83.240.146.443: Flags [P.], seq 1791:2038, ack 3963, win 515, length 247
20:15:16.103915 IP 40.83.240.146.443 > 10.9.10.102.58081: Flags [.], ack 343, win 7850, options [nop,nop,sack 1 {185:343}], length 0
20:15:16.123367 IP 40.83.240.146.443 > 10.9.10.102.58081: Flags [.], ack 1791, win 8192, length 0
20:15:16.123627 IP 40.83.240.146.443 > 10.9.10.102.58081: Flags [P.], seq 3963:4243, ack 2038, win 7945, length 280
20:15:16.127910 IP 40.83.240.146.443 > 10.9.10.102.58081: Flags [P.], seq 4243:4344, ack 2038, win 7945, length 101
20:15:16.128139 IP 40.83.240.146.443 > 10.9.10.102.58081: Flags [P.], seq 4344:4522, ack 2038, win 7945, length 178
20:15:16.129283 IP 10.9.10.102.58081 > 40.83.240.146.443: Flags [.], ack 4522, win 513, length 0
20:15:16.137773 IP 10.9.10.102.58081 > 40.83.240.146.443: Flags [P.], seq 2038:2257, ack 4522, win 513, length 219
20:15:16.218643 IP 40.83.240.146.443 > 10.9.10.102.58081: Flags [P.], seq 4522:4623, ack 2257, win 7726, length 101
20:15:16.272852 IP 10.9.10.102.58081 > 40.83.240.146.443: Flags [.], ack 4623, win 512, length 0
20:15:17.199232 IP 10.9.10.102.138 > 10.9.10.255.138: UDP, length 186
20:15:18.071278 IP 10.9.10.102.58035 > 239.255.255.250.1900: UDP, length 137
20:15:18.747751 IP 10.9.10.102.137 > 10.9.10.255.137: UDP, length 68
20:15:18.794423 IP 10.9.10.102.58035 > 239.255.255.250.1900: UDP, length 137
20:15:18.928243 ARP, Request who-has 10.9.10.102 (00:4f:49:b1:e8:c3) tell 10.9.10.1, length 46
20:15:19.154594 ARP, Reply 10.9.10.102 is-at 00:4f:49:b1:e8:c3, length 46
20:15:19.511263 IP 10.9.10.102.137 > 10.9.10.255.137: UDP, length 68
20:15:20.278616 IP 10.9.10.102.137 > 10.9.10.255.137: UDP, length 68
20:15:21.040842 IP 10.9.10.102.137 > 10.9.10.255.137: UDP, length 68
20:15:21.802832 IP 10.9.10.102.58035 > 239.255.255.250.1900: UDP, length 137
20:15:21.834465 IP 10.9.10.102.138 > 10.9.10.255.138: UDP, length 186
20:15:21.842967 IP 10.9.10.102.138 > 10.9.10.255.138: UDP, length 201
20:15:32.216866 IP 10.9.10.102.58038 > 10.9.10.9.53: 15228+ A? wpad.angrypoutine.com. (39)
20:15:32.217241 IP 10.9.10.9.53 > 10.9.10.102.58038: 15228 NXDomain* 0/1/0 (118)
20:15:45.097383 IP 10.9.10.102.58039 > 10.9.10.9.389: UDP, length 227
20:15:45.097831 IP 10.9.10.9.389 > 10.9.10.102.58039: UDP, length 202
20:15:45.214590 IP 10.9.10.102.58082 > 10.9.10.9.445: Flags [S], seq 1006096658, win 64240, options [mss 1460,nop,wscale 8,nop,nop,sackOK], length 0
20:15:45.214793 IP 10.9.10.9.445 > 10.9.10.102.58082: Flags [S.], seq 2952799695, ack 1006096659, win 65535, options [mss 1460,nop,wscale 8,nop,nop,sackOK], length 0
20:15:45.513707 IP 10.9.10.102.58082 > 10.9.10.9.445: Flags [.], ack 1, win 513, length 0
20:15:45.513859 IP 10.9.10.102.58082 > 10.9.10.9.445: Flags [P.], seq 1:160, ack 1, win 513, length 159
20:15:45.514496 IP 10.9.10.9.445 > 10.9.10.102.58082: Flags [P.], seq 1:253, ack 160, win 512, length 252
20:15:45.516004 IP 10.9.10.102.58082 > 10.9.10.9.445: Flags [P.], seq 160:436, ack 253, win 512, length 276
20:15:45.516603 IP 10.9.10.9.445 > 10.9.10.102.58082: Flags [P.], seq 253:565, ack 436, win 511, length 312
20:15:45.520012 IP 10.9.10.102.58082 > 10.9.10.9.445: Flags [.], seq 436:1896, ack 565, win 511, length 1460
20:15:45.520085 IP 10.9.10.102.58082 > 10.9.10.9.445: Flags [.], seq 1896:3356, ack 565, win 511, length 1460
20:15:45.520131 IP 10.9.10.102.58082 > 10.9.10.9.445: Flags [P.], seq 3356:3912, ack 565, win 511, length 556
20:15:45.520211 IP 10.9.10.9.445 > 10.9.10.102.58082: Flags [.], ack 3912, win 513, length 0
20:15:45.522228 IP 10.9.10.9.445 > 10.9.10.102.58082: Flags [P.], seq 565:825, ack 3912, win 513, length 260
20:15:45.524609 IP 10.9.10.102.58082 > 10.9.10.9.445: Flags [P.], seq 3912:4066, ack 825, win 510, length 154
20:15:45.524761 IP 10.9.10.9.445 > 10.9.10.102.58082: Flags [P.], seq 825:909, ack 4066, win 512, length 84
20:15:45.526976 IP 10.9.10.102.58082 > 10.9.10.9.445: Flags [P.], seq 4066:4190, ack 909, win 509, length 124
20:15:45.526977 IP 10.9.10.102.58082 > 10.9.10.9.445: Flags [P.], seq 4190:4318, ack 909, win 509, length 128
20:15:45.527055 IP 10.9.10.9.445 > 10.9.10.102.58082: Flags [.], ack 4318, win 511, length 0
20:15:45.527187 IP 10.9.10.9.445 > 10.9.10.102.58082: Flags [P.], seq 909:1177, ack 4318, win 511, length 268
20:15:45.527433 IP 10.9.10.9.445 > 10.9.10.102.58082: Flags [P.], seq 1177:1401, ack 4318, win 511, length 224
20:15:45.528671 IP 10.9.10.102.58082 > 10.9.10.9.445: Flags [.], ack 1401, win 507, length 0
20:15:56.228762 IP 10.9.10.102.58082 > 10.9.10.9.445: Flags [P.], seq 4318:4390, ack 1401, win 507, length 72
20:15:56.228990 IP 10.9.10.9.445 > 10.9.10.102.58082: Flags [P.], seq 1401:1473, ack 4390, win 511, length 72
20:15:56.230519 IP 10.9.10.102.58082 > 10.9.10.9.445: Flags [P.], seq 4390:4462, ack 1473, win 513, length 72
20:15:56.230779 IP 10.9.10.9.445 > 10.9.10.102.58082: Flags [P.], seq 1473:1545, ack 4462, win 511, length 72
20:15:56.631123 IP 10.9.10.102.58082 > 10.9.10.9.445: Flags [P.], seq 4390:4462, ack 1473, win 513, length 72
20:15:56.631253 IP 10.9.10.9.445 > 10.9.10.102.58082: Flags [.], ack 4462, win 511, options [nop,nop,sack 1 {4390:4462}], length 0
20:15:56.631494 IP 10.9.10.102.58082 > 10.9.10.9.445: Flags [R.], seq 4462, ack 1545, win 0, length 0
20:15:56.787848 IP 10.9.10.102.58082 > 10.9.10.9.445: Flags [R], seq 1006101120, win 0, length 0
20:16:06.178421 IP 10.9.10.9.445 > 10.9.10.102.52301: Flags [.], seq 4059980456:4059980457, ack 2977194006, win 512, length 1
20:16:06.641137 IP 10.9.10.102.52301 > 10.9.10.9.445: Flags [R], seq 2977194006, win 0, length 0
20:16:32.232266 IP 10.9.10.102.59690 > 10.9.10.9.53: 44274+ A? wpad.angrypoutine.com. (39)
20:16:32.232631 IP 10.9.10.9.53 > 10.9.10.102.59690: 44274 NXDomain* 0/1/0 (118)
20:16:32.881017 IP 10.9.10.102.58035 > 239.255.255.250.1900: UDP, length 137
20:16:35.874381 IP 10.9.10.102.58035 > 239.255.255.250.1900: UDP, length 137
20:16:36.750665 ARP, Request who-has 10.9.10.102 (00:4f:49:b1:e8:c3) tell 10.9.10.9, length 46
20:16:36.803994 ARP, Request who-has 10.9.10.9 (14:18:77:0f:c6:9e) tell 10.9.10.102, length 46
20:16:36.804061 ARP, Reply 10.9.10.9 is-at 14:18:77:0f:c6:9e, length 46
20:16:36.804307 ARP, Reply 10.9.10.102 is-at 00:4f:49:b1:e8:c3, length 46
20:16:36.995240 IP 10.9.10.102.58086 > 10.9.10.9.135: Flags [S], seq 2984779138, win 64240, options [mss 1460,nop,wscale 8,nop,nop,sackOK], length 0
20:16:36.995350 IP 10.9.10.9.135 > 10.9.10.102.58086: Flags [S.], seq 3118247628, ack 2984779139, win 65535, options [mss 1460,nop,wscale 8,nop,nop,sackOK], length 0
20:16:37.277130 IP 10.9.10.102.58086 > 10.9.10.9.135: Flags [.], ack 1, win 513, length 0
20:16:37.277259 IP 10.9.10.102.58086 > 10.9.10.9.135: Flags [P.], seq 1:161, ack 1, win 513, length 160
20:16:37.277658 IP 10.9.10.9.135 > 10.9.10.102.58086: Flags [P.], seq 1:109, ack 161, win 512, length 108
20:16:37.279251 IP 10.9.10.102.58086 > 10.9.10.9.135: Flags [P.], seq 161:329, ack 109, win 512, length 168
20:16:37.279640 IP 10.9.10.9.135 > 10.9.10.102.58086: Flags [P.], seq 109:377, ack 329, win 512, length 268
20:16:37.282443 IP 10.9.10.102.58087 > 10.9.10.9.49671: Flags [S], seq 4140100657, win 64240, options [mss 1460,nop,wscale 8,nop,nop,sackOK], length 0
20:16:37.282627 IP 10.9.10.9.49671 > 10.9.10.102.58087: Flags [S.], seq 486320213, ack 4140100658, win 65535, options [mss 1460,nop,wscale 8,nop,nop,sackOK], length 0
20:16:37.323739 IP 10.9.10.102.58086 > 10.9.10.9.135: Flags [.], ack 377, win 511, length 0
20:16:37.324105 IP 10.9.10.102.58087 > 10.9.10.9.49671: Flags [.], ack 1, win 513, length 0
20:16:37.324253 IP 10.9.10.102.58087 > 10.9.10.9.49671: Flags [P.], seq 1:161, ack 1, win 513, length 160
20:16:37.324510 IP 10.9.10.9.49671 > 10.9.10.102.58087: Flags [P.], seq 1:109, ack 161, win 512, length 108
20:16:37.326155 IP 10.9.10.102.58087 > 10.9.10.9.49671: Flags [P.], seq 161:353, ack 109, win 512, length 192
20:16:37.326560 IP 10.9.10.9.49671 > 10.9.10.102.58087: Flags [P.], seq 109:145, ack 353, win 511, length 36
20:16:37.578635 IP 10.9.10.102.58087 > 10.9.10.9.49671: Flags [P.], seq 161:353, ack 109, win 512, length 192
20:16:37.578763 IP 10.9.10.9.49671 > 10.9.10.102.58087: Flags [.], ack 353, win 511, options [nop,nop,sack 1 {161:353}], length 0
20:16:37.579057 IP 10.9.10.102.58087 > 10.9.10.9.49671: Flags [P.], seq 353:613, ack 145, win 512, length 260
20:16:37.580488 IP 10.9.10.9.49671 > 10.9.10.102.58087: Flags [P.], seq 145:189, ack 613, win 510, length 44
20:16:37.836015 IP 10.9.10.102.58087 > 10.9.10.9.49671: Flags [P.], seq 353:613, ack 145, win 512, length 260
20:16:37.836090 IP 10.9.10.9.49671 > 10.9.10.102.58087: Flags [.], ack 613, win 510, options [nop,nop,sack 1 {353:613}], length 0
20:16:37.836558 IP 10.9.10.102.58087 > 10.9.10.9.49671: Flags [P.], seq 613:765, ack 189, win 512, length 152
20:16:37.836819 IP 10.9.10.9.49671 > 10.9.10.102.58087: Flags [P.], seq 189:265, ack 765, win 510, length 76
20:16:37.838265 IP 10.9.10.102.58087 > 10.9.10.9.49671: Flags [P.], seq 765:1045, ack 265, win 512, length 280
20:16:37.838667 IP 10.9.10.9.49671 > 10.9.10.102.58087: Flags [P.], seq 265:385, ack 1045, win 509, length 120
20:16:37.848651 IP 10.9.10.102.58087 > 10.9.10.9.49671: Flags [P.], seq 1045:2029, ack 385, win 511, length 984
20:16:37.849654 IP 10.9.10.9.49671 > 10.9.10.102.58087: Flags [P.], seq 385:1417, ack 2029, win 513, length 1032
20:16:37.852619 IP 10.9.10.102.58086 > 10.9.10.9.135: Flags [P.], seq 329:497, ack 377, win 511, length 168
20:16:37.852920 IP 10.9.10.9.135 > 10.9.10.102.58086: Flags [P.], seq 377:549, ack 497, win 511, length 172
20:16:37.855589 IP 10.9.10.102.58088 > 10.9.10.9.49667: Flags [S], seq 1507967579, win 64240, options [mss 1460,nop,wscale 8,nop,nop,sackOK], length 0
20:16:37.855773 IP 10.9.10.9.49667 > 10.9.10.102.58088: Flags [S.], seq 3567894538, ack 1507967580, win 65535, options [mss 1460,nop,wscale 8,nop,nop,sackOK], length 0
20:16:37.898462 IP 10.9.10.102.58087 > 10.9.10.9.49671: Flags [.], ack 1417, win 507, length 0
20:16:37.898463 IP 10.9.10.102.58086 > 10.9.10.9.135: Flags [.], ack 549, win 511, length 0
20:16:37.898744 IP 10.9.10.102.58088 > 10.9.10.9.49667: Flags [.], ack 1, win 513, length 0
20:16:37.898908 IP 10.9.10.102.58088 > 10.9.10.9.49667: Flags [P.], seq 1:241, ack 1, win 513, length 240
20:16:37.899133 IP 10.9.10.9.49667 > 10.9.10.102.58088: Flags [P.], seq 1:129, ack 241, win 512, length 128
20:16:37.900734 IP 10.9.10.102.58088 > 10.9.10.9.49667: Flags [P.], seq 241:537, ack 129, win 512, length 296
20:16:37.901503 IP 10.9.10.9.49667 > 10.9.10.102.58088: Flags [P.], seq 129:313, ack 537, win 511, length 184
20:16:37.903863 IP 10.9.10.102.58088 > 10.9.10.9.49667: Flags [P.], seq 537:689, ack 313, win 512, length 152
20:16:37.904028 IP 10.9.10.9.49667 > 10.9.10.102.58088: Flags [P.], seq 313:389, ack 689, win 510, length 76
20:16:37.905603 IP 10.9.10.102.58088 > 10.9.10.9.49667: Flags [P.], seq 689:937, ack 389, win 511, length 248
20:16:37.906336 IP 10.9.10.9.49667 > 10.9.10.102.58088: Flags [P.], seq 389:573, ack 937, win 509, length 184
20:16:37.960833 IP 10.9.10.102.58088 > 10.9.10.9.49667: Flags [.], ack 573, win 511, length 0
20:16:37.993791 IP 10.9.10.102.50665 > 10.9.10.9.53: 51431+ A? fs.microsoft.com. (34)
20:16:38.069599 IP 10.9.10.9.53 > 10.9.10.102.50665: 51431 5/0/0 CNAME prod.fs.microsoft.com.akadns.net., CNAME fs-wildcard.microsoft.com.edgekey.net., CNAME fs-wildcard.microsoft.com.edgekey.net.globalredir.akadns.net., CNAME e1723.g.akamaiedge.net., A 23.3.84.67 (241)
20:16:38.072457 IP 10.9.10.102.58089 > 23.3.84.67.443: Flags [S], seq 3768091134, win 64240, options [mss 1460,nop,wscale 8,nop,nop,sackOK], length 0
20:16:38.148083 IP 23.3.84.67.443 > 10.9.10.102.58089: Flags [S.], seq 2217889747, ack 3768091135, win 64240, options [mss 1361,nop,nop,sackOK,nop,wscale 7], length 0
20:16:38.692572 IP 10.9.10.102.58089 > 23.3.84.67.443: Flags [.], ack 1, win 515, length 0
20:16:38.694974 IP 10.9.10.102.58089 > 23.3.84.67.443: Flags [P.], seq 1:202, ack 1, win 515, length 201
20:16:38.776601 IP 23.3.84.67.443 > 10.9.10.102.58089: Flags [.], ack 202, win 501, length 0
20:16:38.777311 IP 23.3.84.67.443 > 10.9.10.102.58089: Flags [.], seq 1:1362, ack 202, win 501, length 1361
20:16:38.779925 IP 23.3.84.67.443 > 10.9.10.102.58089: Flags [P.], seq 1362:2723, ack 202, win 501, length 1361
20:16:38.780264 IP 23.3.84.67.443 > 10.9.10.102.58089: Flags [.], seq 2723:4084, ack 202, win 501, length 1361
20:16:38.780402 IP 23.3.84.67.443 > 10.9.10.102.58089: Flags [P.], seq 4084:4097, ack 202, win 501, length 13
20:16:38.781372 IP 10.9.10.102.58089 > 23.3.84.67.443: Flags [.], ack 4097, win 515, length 0
20:16:38.852885 IP 23.3.84.67.443 > 10.9.10.102.58089: Flags [.], seq 4097:5458, ack 202, win 501, length 1361
20:16:38.853042 IP 23.3.84.67.443 > 10.9.10.102.58089: Flags [P.], seq 5458:5914, ack 202, win 501, length 456
20:16:38.854344 IP 10.9.10.102.58089 > 23.3.84.67.443: Flags [.], ack 5914, win 515, length 0
20:16:38.859954 IP 10.9.10.102.58089 > 23.3.84.67.443: Flags [P.], seq 202:328, ack 5914, win 515, length 126
20:16:38.880079 IP 10.9.10.102.58035 > 239.255.255.250.1900: UDP, length 137
20:16:38.930456 IP 23.3.84.67.443 > 10.9.10.102.58089: Flags [.], ack 328, win 501, length 0
20:16:38.930735 IP 23.3.84.67.443 > 10.9.10.102.58089: Flags [P.], seq 5914:6172, ack 328, win 501, length 258
20:16:38.955213 IP 10.9.10.102.58089 > 23.3.84.67.443: Flags [P.], seq 328:518, ack 6172, win 514, length 190
20:16:39.037788 IP 23.3.84.67.443 > 10.9.10.102.58089: Flags [.], ack 518, win 501, length 0
20:16:39.038119 IP 23.3.84.67.443 > 10.9.10.102.58089: Flags [P.], seq 6172:6591, ack 518, win 501, length 419
20:16:39.077926 IP 10.9.10.102.58090 > 23.3.84.67.443: Flags [S], seq 4092128279, win 64240, options [mss 1460,nop,wscale 8,nop,nop,sackOK], length 0
20:16:39.088549 IP 10.9.10.102.58089 > 23.3.84.67.443: Flags [.], ack 6591, win 513, length 0
20:16:39.156655 IP 23.3.84.67.443 > 10.9.10.102.58090: Flags [S.], seq 2221038095, ack 4092128280, win 64240, options [mss 1361,nop,nop,sackOK,nop,wscale 7], length 0
20:16:39.392516 IP 10.9.10.102.58090 > 23.3.84.67.443: Flags [.], ack 1, win 515, length 0
20:16:39.393702 IP 10.9.10.102.58090 > 23.3.84.67.443: Flags [P.], seq 1:202, ack 1, win 515, length 201
20:16:39.470299 IP 23.3.84.67.443 > 10.9.10.102.58090: Flags [.], ack 202, win 501, length 0
20:16:39.470926 IP 23.3.84.67.443 > 10.9.10.102.58090: Flags [.], seq 1:1362, ack 202, win 501, length 1361
20:16:39.473068 IP 23.3.84.67.443 > 10.9.10.102.58090: Flags [P.], seq 1362:2723, ack 202, win 501, length 1361
20:16:39.473512 IP 23.3.84.67.443 > 10.9.10.102.58090: Flags [.], seq 2723:4084, ack 202, win 501, length 1361
20:16:39.473708 IP 23.3.84.67.443 > 10.9.10.102.58090: Flags [P.], seq 4084:4097, ack 202, win 501, length 13
20:16:39.474462 IP 10.9.10.102.58090 > 23.3.84.67.443: Flags [.], ack 4097, win 515, length 0
20:16:39.549238 IP 23.3.84.67.443 > 10.9.10.102.58090: Flags [.], seq 4097:5458, ack 202, win 501, length 1361
20:16:39.549298 IP 23.3.84.67.443 > 10.9.10.102.58090: Flags [P.], seq 5458:5914, ack 202, win 501, length 456
20:16:39.550732 IP 10.9.10.102.58090 > 23.3.84.67.443: Flags [.], ack 5914, win 515, length 0
20:16:39.553808 IP 10.9.10.102.58090 > 23.3.84.67.443: Flags [P.], seq 202:328, ack 5914, win 515, length 126
20:16:39.626684 IP 23.3.84.67.443 > 10.9.10.102.58090: Flags [.], ack 328, win 501, length 0
20:16:39.628852 IP 23.3.84.67.443 > 10.9.10.102.58090: Flags [P.], seq 5914:6172, ack 328, win 501, length 258
20:16:39.631953 IP 10.9.10.102.58090 > 23.3.84.67.443: Flags [P.], seq 328:569, ack 6172, win 514, length 241
20:16:39.712935 IP 23.3.84.67.443 > 10.9.10.102.58090: Flags [.], ack 569, win 501, length 0
20:16:39.713061 IP 23.3.84.67.443 > 10.9.10.102.58090: Flags [P.], seq 6172:6432, ack 569, win 501, length 260
20:16:39.742530 IP 10.9.10.102.58091 > 23.3.84.67.443: Flags [S], seq 2495430346, win 64240, options [mss 1460,nop,wscale 8,nop,nop,sackOK], length 0
20:16:39.770227 IP 10.9.10.102.58090 > 23.3.84.67.443: Flags [.], ack 6432, win 513, length 0
20:16:39.821534 IP 23.3.84.67.443 > 10.9.10.102.58091: Flags [S.], seq 2218113041, ack 2495430347, win 64240, options [mss 1361,nop,nop,sackOK,nop,wscale 7], length 0
20:16:40.093593 IP 10.9.10.102.58091 > 23.3.84.67.443: Flags [.], ack 1, win 515, length 0
20:16:40.094805 IP 10.9.10.102.58091 > 23.3.84.67.443: Flags [P.], seq 1:202, ack 1, win 515, length 201
20:16:40.179829 IP 23.3.84.67.443 > 10.9.10.102.58091: Flags [.], ack 202, win 501, length 0
20:16:40.180295 IP 23.3.84.67.443 > 10.9.10.102.58091: Flags [.], seq 1:1362, ack 202, win 501, length 1361
20:16:40.180777 IP 23.3.84.67.443 > 10.9.10.102.58091: Flags [P.], seq 1362:2723, ack 202, win 501, length 1361
20:16:40.181118 IP 23.3.84.67.443 > 10.9.10.102.58091: Flags [.], seq 2723:4084, ack 202, win 501, length 1361
20:16:40.181208 IP 10.9.10.102.58091 > 23.3.84.67.443: Flags [.], ack 2723, win 515, length 0
20:16:40.181273 IP 23.3.84.67.443 > 10.9.10.102.58091: Flags [P.], seq 4084:4097, ack 202, win 501, length 13
20:16:40.182634 IP 10.9.10.102.58091 > 23.3.84.67.443: Flags [.], ack 4097, win 515, length 0
20:16:40.262538 IP 23.3.84.67.443 > 10.9.10.102.58091: Flags [.], seq 4097:5458, ack 202, win 501, length 1361
20:16:40.262641 IP 23.3.84.67.443 > 10.9.10.102.58091: Flags [P.], seq 5458:5914, ack 202, win 501, length 456
20:16:40.264004 IP 10.9.10.102.58091 > 23.3.84.67.443: Flags [.], ack 5914, win 515, length 0
20:16:40.267411 IP 10.9.10.102.58091 > 23.3.84.67.443: Flags [P.], seq 202:328, ack 5914, win 515, length 126
20:16:40.348130 IP 23.3.84.67.443 > 10.9.10.102.58091: Flags [.], ack 328, win 501, length 0
20:16:40.348276 IP 23.3.84.67.443 > 10.9.10.102.58091: Flags [P.], seq 5914:6172, ack 328, win 501, length 258
20:16:40.351170 IP 10.9.10.102.58091 > 23.3.84.67.443: Flags [P.], seq 328:517, ack 6172, win 514, length 189
20:16:40.424122 IP 23.3.84.67.443 > 10.9.10.102.58091: Flags [.], ack 517, win 501, length 0
20:16:40.425702 IP 23.3.84.67.443 > 10.9.10.102.58091: Flags [P.], seq 6172:6608, ack 517, win 501, length 436
20:16:40.474881 IP 10.9.10.102.58091 > 23.3.84.67.443: Flags [.], ack 6608, win 512, length 0
20:16:42.916882 ARP, Request who-has 10.9.10.102 (00:4f:49:b1:e8:c3) tell 10.9.10.1, length 46
20:16:43.611873 ARP, Reply 10.9.10.102 is-at 00:4f:49:b1:e8:c3, length 46
20:16:52.813751 IP 10.9.10.102.58086 > 10.9.10.9.135: Flags [F.], seq 497, ack 549, win 511, length 0
20:16:52.813752 IP 10.9.10.102.58087 > 10.9.10.9.49671: Flags [F.], seq 2029, ack 1417, win 507, length 0
20:16:52.813753 IP 10.9.10.102.58088 > 10.9.10.9.49667: Flags [F.], seq 937, ack 573, win 511, length 0
20:16:52.813924 IP 10.9.10.9.135 > 10.9.10.102.58086: Flags [.], ack 498, win 511, length 0
20:16:52.813925 IP 10.9.10.9.49671 > 10.9.10.102.58087: Flags [.], ack 2030, win 513, length 0
20:16:52.813926 IP 10.9.10.9.49667 > 10.9.10.102.58088: Flags [.], ack 938, win 509, length 0
20:16:52.813961 IP 10.9.10.9.49667 > 10.9.10.102.58088: Flags [F.], seq 573, ack 938, win 509, length 0
20:16:52.813961 IP 10.9.10.9.49671 > 10.9.10.102.58087: Flags [F.], seq 1417, ack 2030, win 513, length 0
20:16:52.814077 IP 10.9.10.9.135 > 10.9.10.102.58086: Flags [F.], seq 549, ack 498, win 511, length 0
20:16:52.815388 IP 10.9.10.102.58088 > 10.9.10.9.49667: Flags [.], ack 574, win 511, length 0
20:16:52.815389 IP 10.9.10.102.58087 > 10.9.10.9.49671: Flags [.], ack 1418, win 507, length 0
20:16:52.815466 IP 10.9.10.102.58086 > 10.9.10.9.135: Flags [.], ack 550, win 511, length 0
20:16:55.749535 IP 10.9.10.102.58092 > 10.9.10.9.88: Flags [S], seq 319490153, win 64240, options [mss 1460,nop,wscale 8,nop,nop,sackOK], length 0
20:16:55.749774 IP 10.9.10.9.88 > 10.9.10.102.58092: Flags [S.], seq 4068870374, ack 319490154, win 65535, options [mss 1460,nop,wscale 8,nop,nop,sackOK], length 0
20:16:55.760823 IP 10.9.10.102.50666 > 10.9.10.9.389: UDP, length 227
20:16:55.760917 IP 10.9.10.102.58092 > 10.9.10.9.88: Flags [.], ack 1, win 513, length 0
20:16:55.761043 IP 10.9.10.102.58092 > 10.9.10.9.88: Flags [P.], seq 1:242, ack 1, win 513, length 241
20:16:55.761277 IP 10.9.10.9.389 > 10.9.10.102.50666: UDP, length 202
20:16:55.762030 IP 10.9.10.9.88 > 10.9.10.102.58092: Flags [P.], seq 1:206, ack 242, win 512, length 205
20:16:55.762661 IP 10.9.10.102.58092 > 10.9.10.9.88: Flags [F.], seq 242, ack 206, win 512, length 0
20:16:55.762796 IP 10.9.10.9.88 > 10.9.10.102.58092: Flags [.], ack 243, win 512, length 0
20:16:55.762845 IP 10.9.10.9.88 > 10.9.10.102.58092: Flags [R.], seq 206, ack 243, win 0, length 0
20:16:55.771534 IP 10.9.10.102.58093 > 10.9.10.9.88: Flags [S], seq 2233360629, win 64240, options [mss 1460,nop,wscale 8,nop,nop,sackOK], length 0
20:16:55.771729 IP 10.9.10.9.88 > 10.9.10.102.58093: Flags [S.], seq 4263251484, ack 2233360630, win 65535, options [mss 1460,nop,wscale 8,nop,nop,sackOK], length 0
20:16:55.983405 IP 10.9.10.102.58094 > 10.9.10.9.135: Flags [S], seq 3675910360, win 64240, options [mss 1460,nop,wscale 8,nop,nop,sackOK], length 0
20:16:55.983534 IP 10.9.10.102.58093 > 10.9.10.9.88: Flags [.], ack 1, win 513, length 0
20:16:55.983554 IP 10.9.10.9.135 > 10.9.10.102.58094: Flags [S.], seq 2322629837, ack 3675910361, win 65535, options [mss 1460,nop,wscale 8,nop,nop,sackOK], length 0
20:16:55.983665 IP 10.9.10.102.58093 > 10.9.10.9.88: Flags [P.], seq 1:322, ack 1, win 513, length 321
20:16:55.984867 IP 10.9.10.102.58094 > 10.9.10.9.135: Flags [.], ack 1, win 513, length 0
20:16:55.985034 IP 10.9.10.102.58094 > 10.9.10.9.135: Flags [P.], seq 1:161, ack 1, win 513, length 160
20:16:55.985465 IP 10.9.10.9.88 > 10.9.10.102.58093: Flags [.], seq 1:1461, ack 322, win 512, length 1460
20:16:55.985466 IP 10.9.10.9.88 > 10.9.10.102.58093: Flags [P.], seq 1461:1691, ack 322, win 512, length 230
20:16:55.985467 IP 10.9.10.9.135 > 10.9.10.102.58094: Flags [P.], seq 1:109, ack 161, win 4106, length 108
20:16:55.986692 IP 10.9.10.102.58093 > 10.9.10.9.88: Flags [.], ack 1691, win 513, length 0
20:16:55.986693 IP 10.9.10.102.58093 > 10.9.10.9.88: Flags [F.], seq 322, ack 1691, win 513, length 0
20:16:55.986720 IP 10.9.10.102.58094 > 10.9.10.9.135: Flags [P.], seq 161:329, ack 109, win 512, length 168
20:16:55.986771 IP 10.9.10.9.88 > 10.9.10.102.58093: Flags [.], ack 323, win 512, length 0
20:16:55.986871 IP 10.9.10.9.88 > 10.9.10.102.58093: Flags [R.], seq 1691, ack 323, win 0, length 0
20:16:55.987179 IP 10.9.10.9.135 > 10.9.10.102.58094: Flags [P.], seq 109:281, ack 329, win 4105, length 172
20:16:55.989152 IP 10.9.10.102.58095 > 10.9.10.9.88: Flags [S], seq 1368361865, win 64240, options [mss 1460,nop,wscale 8,nop,nop,sackOK], length 0
20:16:55.989232 IP 10.9.10.9.88 > 10.9.10.102.58095: Flags [S.], seq 2145388059, ack 1368361866, win 65535, options [mss 1460,nop,wscale 8,nop,nop,sackOK], length 0
20:16:55.993777 IP 10.9.10.102.58096 > 10.9.10.9.49667: Flags [S], seq 1552507771, win 64240, options [mss 1460,nop,wscale 8,nop,nop,sackOK], length 0
20:16:55.993908 IP 10.9.10.9.49667 > 10.9.10.102.58096: Flags [S.], seq 2208717417, ack 1552507772, win 65535, options [mss 1460,nop,wscale 8,nop,nop,sackOK], length 0
20:16:55.993924 IP 10.9.10.102.58095 > 10.9.10.9.88: Flags [.], ack 1, win 513, length 0
20:16:55.994236 IP 10.9.10.102.58095 > 10.9.10.9.88: Flags [.], seq 1:1461, ack 1, win 513, length 1460
20:16:55.994240 IP 10.9.10.102.58095 > 10.9.10.9.88: Flags [P.], seq 1461:1596, ack 1, win 513, length 135
20:16:55.994308 IP 10.9.10.9.88 > 10.9.10.102.58095: Flags [.], ack 1596, win 4106, length 0
20:16:55.995243 IP 10.9.10.9.88 > 10.9.10.102.58095: Flags [.], seq 1:1461, ack 1596, win 4106, length 1460
20:16:55.995245 IP 10.9.10.9.88 > 10.9.10.102.58095: Flags [P.], seq 1461:1658, ack 1596, win 4106, length 197
20:16:55.995246 IP 10.9.10.102.58096 > 10.9.10.9.49667: Flags [.], ack 1, win 513, length 0
20:16:55.995888 IP 10.9.10.102.58097 > 10.9.10.9.88: Flags [S], seq 1425891199, win 64240, options [mss 1460,nop,wscale 8,nop,nop,sackOK], length 0
20:16:55.996022 IP 10.9.10.9.88 > 10.9.10.102.58097: Flags [S.], seq 434410124, ack 1425891200, win 65535, options [mss 1460,nop,wscale 8,nop,nop,sackOK], length 0
20:16:55.996414 IP 10.9.10.102.58095 > 10.9.10.9.88: Flags [.], ack 1658, win 513, length 0
20:16:55.996415 IP 10.9.10.102.58095 > 10.9.10.9.88: Flags [F.], seq 1596, ack 1658, win 513, length 0
20:16:55.996442 IP 10.9.10.102.58097 > 10.9.10.9.88: Flags [.], ack 1, win 4106, length 0
20:16:55.996508 IP 10.9.10.9.88 > 10.9.10.102.58095: Flags [.], ack 1597, win 4106, length 0
20:16:55.996535 IP 10.9.10.9.88 > 10.9.10.102.58095: Flags [R.], seq 1658, ack 1597, win 0, length 0
20:16:55.996631 IP 10.9.10.102.58097 > 10.9.10.9.88: Flags [P.], seq 1:250, ack 1, win 4106, length 249
20:16:55.996983 IP 10.9.10.9.88 > 10.9.10.102.58097: Flags [P.], seq 1:214, ack 250, win 4106, length 213
20:16:55.997815 IP 10.9.10.102.58097 > 10.9.10.9.88: Flags [F.], seq 250, ack 214, win 4105, length 0
20:16:55.997907 IP 10.9.10.9.88 > 10.9.10.102.58097: Flags [.], ack 251, win 4106, length 0
20:16:55.997987 IP 10.9.10.9.88 > 10.9.10.102.58097: Flags [R.], seq 214, ack 251, win 0, length 0
20:16:56.018526 IP 10.9.10.102.58098 > 10.9.10.9.88: Flags [S], seq 3617458872, win 64240, options [mss 1460,nop,wscale 8,nop,nop,sackOK], length 0
20:16:56.018723 IP 10.9.10.9.88 > 10.9.10.102.58098: Flags [S.], seq 1849881348, ack 3617458873, win 65535, options [mss 1460,nop,wscale 8,nop,nop,sackOK], length 0
20:16:56.019730 IP 10.9.10.9.135 > 10.9.10.102.58094: Flags [P.], seq 109:281, ack 329, win 4105, length 172
20:16:56.020152 IP 10.9.10.102.58094 > 10.9.10.9.135: Flags [.], ack 281, win 512, options [nop,nop,sack 1 {109:281}], length 0
20:16:56.020222 IP 10.9.10.102.58098 > 10.9.10.9.88: Flags [P.], seq 1:330, ack 1, win 513, length 329
20:16:56.021276 IP 10.9.10.9.88 > 10.9.10.102.58098: Flags [.], seq 1:1461, ack 330, win 4106, length 1460
20:16:56.021278 IP 10.9.10.9.88 > 10.9.10.102.58098: Flags [P.], seq 1461:1691, ack 330, win 4106, length 230
20:16:56.022529 IP 10.9.10.102.58098 > 10.9.10.9.88: Flags [.], ack 1691, win 513, length 0
20:16:56.022614 IP 10.9.10.102.58098 > 10.9.10.9.88: Flags [F.], seq 330, ack 1691, win 513, length 0
20:16:56.022742 IP 10.9.10.9.88 > 10.9.10.102.58098: Flags [.], ack 331, win 4106, length 0
20:16:56.022743 IP 10.9.10.9.88 > 10.9.10.102.58098: Flags [R.], seq 1691, ack 331, win 0, length 0
20:16:56.057900 IP 10.9.10.102.58099 > 10.9.10.9.88: Flags [S], seq 4037037087, win 64240, options [mss 1460,nop,wscale 8,nop,nop,sackOK], length 0
20:16:56.058031 IP 10.9.10.9.88 > 10.9.10.102.58099: Flags [S.], seq 632986690, ack 4037037088, win 65535, options [mss 1460,nop,wscale 8,nop,nop,sackOK], length 0
20:16:56.108273 IP 10.9.10.102.58100 > 10.9.10.9.445: Flags [S], seq 3922267675, win 64240, options [mss 1460,nop,wscale 8,nop,nop,sackOK], length 0
20:16:56.108432 IP 10.9.10.102.58099 > 10.9.10.9.88: Flags [.], ack 1, win 513, length 0
20:16:56.108433 IP 10.9.10.9.445 > 10.9.10.102.58100: Flags [S.], seq 1727423661, ack 3922267676, win 65535, options [mss 1460,nop,wscale 8,nop,nop,sackOK], length 0
20:16:56.108758 IP 10.9.10.102.58099 > 10.9.10.9.88: Flags [.], seq 1:1461, ack 1, win 513, length 1460
20:16:56.108829 IP 10.9.10.102.58099 > 10.9.10.9.88: Flags [P.], seq 1461:1769, ack 1, win 513, length 308
20:16:56.108830 IP 10.9.10.9.88 > 10.9.10.102.58099: Flags [.], ack 1769, win 513, length 0
20:16:56.109764 IP 10.9.10.9.88 > 10.9.10.102.58099: Flags [.], seq 1:1461, ack 1769, win 513, length 1460
20:16:56.109766 IP 10.9.10.102.58100 > 10.9.10.9.445: Flags [.], ack 1, win 513, length 0
20:16:56.109766 IP 10.9.10.9.88 > 10.9.10.102.58099: Flags [P.], seq 1461:1784, ack 1769, win 513, length 323
20:16:56.110555 IP 10.9.10.102.58100 > 10.9.10.9.445: Flags [P.], seq 1:257, ack 1, win 513, length 256
20:16:56.110894 IP 10.9.10.102.58099 > 10.9.10.9.88: Flags [.], ack 1784, win 513, length 0
20:16:56.110927 IP 10.9.10.102.58099 > 10.9.10.9.88: Flags [F.], seq 1769, ack 1784, win 513, length 0
20:16:56.110972 IP 10.9.10.9.88 > 10.9.10.102.58099: Flags [.], ack 1770, win 513, length 0
20:16:56.111042 IP 10.9.10.9.88 > 10.9.10.102.58099: Flags [R.], seq 1784, ack 1770, win 0, length 0
20:16:56.111087 IP 10.9.10.9.445 > 10.9.10.102.58100: Flags [P.], seq 1:313, ack 257, win 4106, length 312
20:16:56.111746 IP 10.9.10.102.58096 > 10.9.10.9.49667: Flags [.], seq 1:1461, ack 1, win 513, length 1460
20:16:56.111775 IP 10.9.10.102.58096 > 10.9.10.9.49667: Flags [P.], seq 1461:2165, ack 1, win 513, length 704
20:16:56.111892 IP 10.9.10.9.49667 > 10.9.10.102.58096: Flags [.], ack 2165, win 4106, length 0
20:16:56.112496 IP 10.9.10.9.49667 > 10.9.10.102.58096: Flags [P.], seq 1:285, ack 2165, win 4106, length 284
20:16:56.129128 IP 10.9.10.9.49667 > 10.9.10.102.58096: Flags [P.], seq 1:285, ack 2165, win 4106, length 284
20:16:56.129129 IP 10.9.10.9.445 > 10.9.10.102.58100: Flags [P.], seq 1:313, ack 257, win 4106, length 312
20:16:56.130332 IP 10.9.10.102.58096 > 10.9.10.9.49667: Flags [.], ack 285, win 512, options [nop,nop,sack 1 {1:285}], length 0
20:16:56.130333 IP 10.9.10.102.58100 > 10.9.10.9.445: Flags [.], ack 313, win 512, options [nop,nop,sack 1 {1:313}], length 0
20:16:56.200561 IP 10.9.10.102.58096 > 10.9.10.9.49667: Flags [P.], seq 2165:2385, ack 285, win 512, length 220
20:16:56.200563 IP 10.9.10.102.58101 > 10.9.10.9.88: Flags [S], seq 3199461530, win 64240, options [mss 1460,nop,wscale 8,nop,nop,sackOK], length 0
20:16:56.200603 IP 10.9.10.9.88 > 10.9.10.102.58101: Flags [S.], seq 3619689194, ack 3199461531, win 65535, options [mss 1460,nop,wscale 8,nop,nop,sackOK], length 0
